{
  "schemaVersion": "pptlint-edit-eval/v1",
  "title": "PPTLint Real-World Editing and Source-Grounded Presentation Evaluation",
  "scoreModel": {
    "businessEdit": {"machine": 85, "humanVisual": 15},
    "sourceGrounded": "reported separately; fidelity is a hard gate"
  },
  "cases": [
    {
      "id": "business-01-cover-date",
      "title": "只改封面月份，不碰其余页面",
      "track": "business-edit",
      "mode": "edit",
      "sourceId": "business-01",
      "difficulty": 1,
      "operationClass": "atomic-text-update",
      "instruction": "将第1页封面月份由“2025年9月”更新为“2025年10月”。只允许修改第1页中对应日期，字体、位置、版式、动画和其他页面保持不变。",
      "manualAdjustment": ["在缩略图中只选中第1页并双击日期文本框。", "仅替换月份，使用格式刷或原字符格式保持字体、字号和颜色。", "另存副本，前后快速切换确认除日期外无位移。"],
      "productAction": {"label": "一键仅更新封面日期", "scope": "slide-1-target-text-only", "previewRequired": true},
      "acceptance": {"allowedSlideChanges": [1], "preserveSlideCount": true, "preserveUntouchedSlides": true, "requiredText": [{"slide": 1, "contains": "2025 年 10 月"}], "forbiddenText": [{"slide": 1, "contains": "2025 年 9 月"}], "noNewHighConfidenceFindings": true, "maxNativeObjectRatioDrop": 0.0, "maxDurationSeconds": 60},
      "humanReview": {"points": 15, "criteria": ["日期与原封面基线一致", "字距和行距没有异常", "看不出整页被重新生成"]},
      "failureConditions": ["第2至9页任一页面发生变化", "日期文本变成图片", "操作超过60秒"]
    },
    {
      "id": "business-01-overlap-fix",
      "title": "修复案例页文字重叠",
      "track": "business-edit",
      "mode": "edit",
      "sourceId": "business-01",
      "difficulty": 2,
      "operationClass": "local-layout-repair",
      "instruction": "仅修复第7页的文字重叠，让案例说明在投屏时可完整阅读。不得删减事实或改写业务含义，不得把页面转成整页图片。",
      "manualAdjustment": ["打开选择窗格定位相互遮挡的文本框。", "先调整文本框高度与段落间距，再微调对象间距；不要先缩小字号。", "以100%比例检查边缘，并与相邻案例页对照样式。"],
      "productAction": {"label": "一键修复本页重叠", "scope": "slide-7-overlap-only", "previewRequired": true},
      "acceptance": {"allowedSlideChanges": [7], "preserveSlideCount": true, "preserveUntouchedSlides": true, "mustReduceRules": [{"ruleId": "readability.text-overlap", "slides": [7], "minimumReduction": 1}], "noNewHighConfidenceFindings": true, "maxNativeObjectRatioDrop": 0.0, "maxDurationSeconds": 120},
      "humanReview": {"points": 15, "criteria": ["文字完整可读", "层级仍与第5至6页一致", "没有用极小字号换空间"]},
      "failureConditions": ["删掉案例信息", "改变其他案例页", "新增重叠、越界或整页截图"]
    },
    {
      "id": "business-01-support-readability",
      "title": "改善专项费用页的阅读层级",
      "track": "business-edit",
      "mode": "edit",
      "sourceId": "business-01",
      "difficulty": 2,
      "operationClass": "single-slide-readability",
      "instruction": "只优化第8页，让标题和重点金额更容易识别，并解决小字号问题。保留全部业务文字、既有配色和标注含义。",
      "manualAdjustment": ["补充可识别的页标题或将现有标题设为明确标题层级。", "放大最小字号并通过缩短行长、增加文本框高度解决空间。", "对齐金额、说明和标注，检查标注没有压住正文。"],
      "productAction": {"label": "一键提升本页可读性", "scope": "slide-8-readability-only", "previewRequired": true},
      "acceptance": {"allowedSlideChanges": [8], "preserveSlideCount": true, "preserveUntouchedSlides": true, "mustReduceRules": [{"ruleId": "readability.small-font", "slides": [8], "minimumReduction": 1}, {"ruleId": "accessibility.missing-title", "slides": [8], "minimumReduction": 1}], "noNewHighConfidenceFindings": true, "maxNativeObjectRatioDrop": 0.0, "maxDurationSeconds": 150},
      "humanReview": {"points": 15, "criteria": ["三秒内能看出金额和用途", "信息没有被删减", "仍符合原稿的蓝色业务风格"]},
      "failureConditions": ["以整页重排替代局部优化", "删除标注或条件说明", "第8页之外出现变化"]
    },
    {
      "id": "business-02-offcanvas-overview",
      "title": "修复数据总览页越界文字",
      "track": "business-edit",
      "mode": "edit",
      "sourceId": "business-02",
      "difficulty": 2,
      "operationClass": "off-canvas-repair",
      "instruction": "仅修复第2页超出画布的文字或对象，使内容完整留在安全边距内。保留原有总览结构和全部入口名称。",
      "manualAdjustment": ["使用选择窗格定位越界对象。", "选择“对齐到幻灯片”，把对象移回安全边距并保持原网格。", "播放模式检查边缘文字是否完整显示。"],
      "productAction": {"label": "一键收回越界内容", "scope": "slide-2-off-canvas-only", "previewRequired": true},
      "acceptance": {"allowedSlideChanges": [2], "preserveSlideCount": true, "preserveUntouchedSlides": true, "mustReduceRules": [{"ruleId": "readability.off-canvas-text", "slides": [2], "minimumReduction": 1}], "noNewHighConfidenceFindings": true, "maxNativeObjectRatioDrop": 0.0, "maxDurationSeconds": 90},
      "humanReview": {"points": 15, "criteria": ["所有入口名称可见", "总览关系没有变", "页面边缘留白自然"]},
      "failureConditions": ["直接删除越界对象", "压缩为难读的小字", "其他页面发生变化"]
    },
    {
      "id": "business-02-marketing-screenshot",
      "title": "整理营销中台截图与说明",
      "track": "business-edit",
      "mode": "edit",
      "sourceId": "business-02",
      "difficulty": 3,
      "operationClass": "screenshot-annotation-repair",
      "instruction": "只优化第11页：修复越界文字，让截图、枚举说明和红色提示能按顺序阅读。截图内容不可拉伸变形，枚举值不可改写。",
      "manualAdjustment": ["先锁定截图宽高比并裁剪无关空白。", "将说明框移回画布，按截图操作顺序排列。", "统一提示线、编号和正文的对齐与间距。"],
      "productAction": {"label": "一键整理截图说明", "scope": "slide-11-screenshot-and-annotations", "previewRequired": true},
      "acceptance": {"allowedSlideChanges": [11], "preserveSlideCount": true, "preserveUntouchedSlides": true, "mustReduceRules": [{"ruleId": "readability.off-canvas-text", "slides": [11], "minimumReduction": 1}, {"ruleId": "readability.small-font", "slides": [11], "minimumReduction": 1}], "noNewHighConfidenceFindings": true, "maxNativeObjectRatioDrop": 0.0, "maxDurationSeconds": 180},
      "humanReview": {"points": 15, "criteria": ["截图没有变形", "操作顺序一眼可见", "提示和枚举仍准确对应"]},
      "failureConditions": ["重绘或猜测截图内容", "改动枚举值", "用整页截图覆盖原生文本"]
    },
    {
      "id": "business-02-pension-example",
      "title": "修复养老金案例页重叠",
      "track": "business-edit",
      "mode": "edit",
      "sourceId": "business-02",
      "difficulty": 3,
      "operationClass": "dense-screenshot-layout",
      "instruction": "仅修复第12页文本重叠，并改善说明与截图的对应关系。必须保留“包含”与“等于”的业务提醒，不得改变筛选规则。",
      "manualAdjustment": ["定位发生重叠的文本框并确认其对应截图区域。", "通过重新分栏、调整文本框高度和段落间距释放空间。", "最后检查关键提醒没有被裁切或拆散。"],
      "productAction": {"label": "一键修复案例页布局", "scope": "slide-12-overlap-and-flow", "previewRequired": true},
      "acceptance": {"allowedSlideChanges": [12], "preserveSlideCount": true, "preserveUntouchedSlides": true, "mustReduceRules": [{"ruleId": "readability.text-overlap", "slides": [12], "minimumReduction": 1}], "requiredText": [{"slide": 12, "contains": "必须选择“包含”，不能选“等于”"}], "noNewHighConfidenceFindings": true, "maxNativeObjectRatioDrop": 0.0, "maxDurationSeconds": 180},
      "humanReview": {"points": 15, "criteria": ["关键提醒醒目且不夸张", "说明与截图位置对应", "内容没有因压缩变得更难读"]},
      "failureConditions": ["关键筛选提醒丢失", "截图变形", "其他案例页被统一重排"]
    },
    {
      "id": "business-03-cover-date",
      "title": "更新赋能会封面月份",
      "track": "business-edit",
      "mode": "edit",
      "sourceId": "business-03",
      "difficulty": 1,
      "operationClass": "atomic-text-update",
      "instruction": "将第1页月份从“2025年8月”改为“2025年9月”，其余文字、版式和18页结构保持不变。",
      "manualAdjustment": ["只进入第1页日期文本框。", "替换月份并保留原字符样式。", "另存后对照原稿确认其他页面无变化。"],
      "productAction": {"label": "一键更新封面月份", "scope": "slide-1-target-text-only", "previewRequired": true},
      "acceptance": {"allowedSlideChanges": [1], "preserveSlideCount": true, "preserveUntouchedSlides": true, "requiredText": [{"slide": 1, "contains": "2025 年 9 月"}], "forbiddenText": [{"slide": 1, "contains": "2025 年 8 月"}], "noNewHighConfidenceFindings": true, "maxNativeObjectRatioDrop": 0.0, "maxDurationSeconds": 60},
      "humanReview": {"points": 15, "criteria": ["日期与原封面样式一致", "没有新增不必要元素", "不存在明显字符间距变化"]},
      "failureConditions": ["修改目录或正文", "封面被整页重做", "日期文本不可编辑"]
    },
    {
      "id": "business-03-progress-table",
      "title": "修复发卡进度页越界",
      "track": "business-edit",
      "mode": "edit",
      "sourceId": "business-03",
      "difficulty": 3,
      "operationClass": "table-and-label-repair",
      "instruction": "只修复第9页越界文字，并保持前五、后五和整体进度三块信息的比较关系。不得删除机构、比例或状态信息。",
      "manualAdjustment": ["定位越界对象，先判断是否属于表格、标签或装饰。", "保持三块比较区域的同一基线，收紧非内容留白。", "检查所有数字、机构名和状态仍完整。"],
      "productAction": {"label": "一键修复进度页", "scope": "slide-9-off-canvas-and-grid", "previewRequired": true},
      "acceptance": {"allowedSlideChanges": [9], "preserveSlideCount": true, "preserveUntouchedSlides": true, "mustReduceRules": [{"ruleId": "readability.off-canvas-text", "slides": [9], "minimumReduction": 1}], "noNewHighConfidenceFindings": true, "maxNativeObjectRatioDrop": 0.0, "maxDurationSeconds": 180},
      "humanReview": {"points": 15, "criteria": ["三块比较关系清楚", "表格数字可核对", "没有牺牲字号来塞回页面"]},
      "failureConditions": ["删除排名或比例", "打散原生表格为图片", "修改第9页之外内容"]
    },
    {
      "id": "business-03-campus-overlap",
      "title": "修复高校合作页重叠",
      "track": "business-edit",
      "mode": "edit",
      "sourceId": "business-03",
      "difficulty": 2,
      "operationClass": "local-layout-repair",
      "instruction": "仅修复第14页文字重叠，保留问题痛点、经验做法和页面原有编号。优化后应更容易区分问题与经验。",
      "manualAdjustment": ["将问题痛点和经验做法拆成两个明确内容区。", "调整文本框高度、段落间距和对象对齐。", "与第13、15页对照，保持同一章节风格。"],
      "productAction": {"label": "一键区分问题与做法", "scope": "slide-14-overlap-and-hierarchy", "previewRequired": true},
      "acceptance": {"allowedSlideChanges": [14], "preserveSlideCount": true, "preserveUntouchedSlides": true, "mustReduceRules": [{"ruleId": "readability.text-overlap", "slides": [14], "minimumReduction": 1}], "noNewHighConfidenceFindings": true, "maxNativeObjectRatioDrop": 0.0, "maxDurationSeconds": 150},
      "humanReview": {"points": 15, "criteria": ["问题与经验层级清晰", "原有编号和事实完整", "视觉风格与本章节连续"]},
      "failureConditions": ["把文字总结成模型自创内容", "删掉问题或经验", "引入新重叠"]
    },
    {
      "id": "business-04-cover-date",
      "title": "更新经营分析封面月份",
      "track": "business-edit",
      "mode": "edit",
      "sourceId": "business-04",
      "difficulty": 1,
      "operationClass": "atomic-text-update",
      "instruction": "将第1页“2025年6月”改为“2025年7月”，不得修改任何经营数据或后续页面。",
      "manualAdjustment": ["只编辑第1页日期文本。", "保持原字符格式与位置。", "保存副本并确认15页页数不变。"],
      "productAction": {"label": "一键更新封面月份", "scope": "slide-1-target-text-only", "previewRequired": true},